<?xml version="1.0" encoding="UTF-8"?>
<xs:schema xmlns:xs="http://www.w3.org/2001/XMLSchema">
    <xs:element name="books">
        <xs:complexType>
            <xs:sequence>
                <xs:element name="book" maxOccurs="unbounded">
                    <xs:complexType>
                        <xs:sequence>
                            <xs:element name="title" type="xs:string"></xs:element>
                            <xs:element name="authors">
                                <xs:complexType>
                                    <xs:sequence>
                                        <xs:element name="author" minOccurs="1" maxOccurs="unbounded"></xs:element>
                                    </xs:sequence>
                                </xs:complexType>
                            </xs:element>
                            <xs:element name="release_year" type="xs:unsignedShort"></xs:element>
                            <xs:element name="publisher" type="xs:string"></xs:element>
                        </xs:sequence>
                        <xs:attribute name="id" type="xs:string" use="required"></xs:attribute>
                    </xs:complexType>
                </xs:element>
            </xs:sequence>
        </xs:complexType>
    </xs:element>
</xs:schema>